{
  "systems": {
    "simple_worldbuilding_system": {
      "name": "Simple Worldbuilding System",
      "manifest": "https://raw.githubusercontent.com/foundryvtt/worldbuilding/HEAD/system.json",
      "install_at_startup": true
    }
  },
  "modules": {
    "foundryvtt_over_my_head": {
      "name": "FoundryVTT Over My Head",
      "manifest": "https://raw.githubusercontent.com/foundryvtt-over-my-head/foundryvtt-over-my-head/HEAD/module.json",
      "install_at_startup": false
    }
  },
  "worlds": {
    "over_my_head_dev_world": {
      "name": "Over My Head Dev World",
      "manifest": "",
      "path": "/host/world/test-world",
      "install_at_startup": false
    }
  },
  "versions": {
    "13": {
      "supported": true,
      "install": {
        "systems": {
          "simple_worldbuilding_system": {}
        },
        "modules": {
          "foundryvtt_over_my_head": {}
        },
        "worlds": {
          "over_my_head_dev_world": {}
        }
      }
    },

    "12": {
      "supported": true,
      "install": {
        "systems": {
          "simple_worldbuilding_system": {}
        },
        "modules": {
          "foundryvtt_over_my_head": {}
        },
        "worlds": {
          "over_my_head_dev_world": {}
        }
      }
    },

    "11": {
      "supported": true,
      "install": {
        "systems": {
          "simple_worldbuilding_system": {}
        },
        "modules": {
          "foundryvtt_over_my_head": {}
        },
        "worlds": {
          "over_my_head_dev_world": {}
        }
      }
    }
  }
}